,paragraph_number,paragraph
1078,1079,The theorem follows from the preceding by dividing by T and using Jensen’s in which the log(T) term is eliminated for a variant of the algorithm in which
1079,1080,We have so far introduced and analyzed the SGD algorithm for general convex functions. Now we shall consider its applicability to learning tasks.
1080,1081,SGD for Risk Minimization
1081,1082,Recall that in learning we face the problem of minimizing the risk function
1082,1083,"We have seen the method of empirical risk minimization, where we minimize the empirical risk, LS(w), as an estimate to minimizing LD(w). SGD allows us to take a diﬀerent approach and minimize LD(w) directly. Since we do not know"
1083,1084,"D, we cannot simply calculate ∇LD(w(t)) and minimize it with the GD method."
1084,1085,"With SGD, however, all we need is to ﬁnd an unbiased estimate of the gradient of"
1085,1086,"LD(w), that is, a random vector whose conditional expected value is ∇LD(w(t))."
1086,1087,We shall now see how such an estimate can be easily constructed.
1087,1088,"For simplicity, let us ﬁrst consider the case of diﬀerentiable loss functions."
1088,1089,"Hence the risk function LD is also diﬀerentiable. The construction of the random vector vt will be as follows: First, sample z ∼D. Then, deﬁne vt to be the gradient of the function ℓ(w, z) with respect to w, at the point w(t). Then, by the linearity of the gradient we have z∼D[∇ℓ(w(t), z)] = ∇E z∼D[ℓ(w(t), z)] = ∇LD(w(t))."
1089,1090,"The gradient of the loss function ℓ(w, z) at w(t) is therefore an unbiased estimate of the gradient of the risk function LD(w(t)) and is easily constructed by sampling a single fresh example z ∼D at each iteration t."
1090,1091,"The same argument holds for nondiﬀerentiable loss functions. We simply let vt be a subgradient of ℓ(w, z) at w(t). Then, for every u we have ℓ(u, z) −ℓ(w(t), z) ≥⟨u −w(t), vt⟩."
1091,1092,Taking expectation on both sides with respect to z ∼D and conditioned on the value of w(t) we obtain
1092,1093,"LD(u) −LD(w(t)) = E[ℓ(u, z) −ℓ(w(t), z)|w(t)] ≥E[⟨u −w(t), vt⟩|w(t)] = ⟨u −w(t), E[vt|w(t)]⟩."
1093,1094,It follows that E[vt|w(t)] is a subgradient of LD(w) at w(t).
1094,1095,"To summarize, the stochastic gradient descent framework for minimizing the"
1095,1096,Stochastic Gradient Descent (SGD) for minimizing
1096,1097,Stochastic Gradient Descent
1097,1098,"LD(w) with a number of iterations (i.e., number of examples) ρ2 T , then the output of SGD satisﬁes"
1098,1099,"It is interesting to note that the required sample complexity is of the same order of magnitude as the sample complexity guarantee we derived for regularized loss minimization. In fact, the sample complexity of SGD is even better than what"
1099,1100,In the previous chapter we saw that the regularized loss minimization rule also the SGD algorithm can be also used for such problems.
1100,1101,"Assume that for all z, the loss function ℓ(·, z) is convex, β- smooth, and nonnegative. Then, if we run the SGD algorithm for minimizing"
1101,1102,"LD(w) we have that for every w⋆, samples of the SGD algorithm, let ft(·) = ℓ(·, zt), and note that vt = ∇ft(w(t))."
1102,1103,"For all t, ft is a convex function and therefore ft(w(t))−ft(w⋆) ≤⟨vt, w(t)−w⋆⟩. (ft(w(t)) −ft(w⋆)) ≤"
1103,1104,"Dividing by T and rearranging, we obtain"
1104,1105,"Next, we take expectation of the two sides of the preceding equation with respect to z1, . . . , zT . Clearly, E[ft(w⋆)] = LD(w⋆). In addition, using the same argument"
1105,1106,Combining all we conclude our proof.
1106,1107,As a direct corollary we obtain:
1107,1108,"SGD for Regularized Loss Minimization as regularized loss minimization. However, on some distributions, regularized loss minimization may yield a better solution. Therefore, in some cases we may want to solve the optimization problem associated with regularized loss minimization,"
1108,1109,"Since we are dealing with convex learning problems in which the loss function is convex, the preceding problem is also a convex optimization problem that can be solved using SGD as well, as we shall see in this section."
1109,1110,"To apply this algorithm, we only need to ﬁnd a way to construct an unbiased estimate of a subgradient of f at w(t). This is easily done by noting that if"
1110,1111,"To analyze the resulting algorithm, we ﬁrst rewrite the update rule (assuming"
1111,1112,Stochastic Gradient Descent that H = Rd and therefore the projection step does not matter) as follows
1112,1113,"If we assume that the loss function is ρ-Lipschitz, it follows that for all t we have ∥vt∥≤ρ and therefore ∥λw(t)∥≤ρ, which yields"
1113,1114,"E[f( ¯w)] −f(w⋆) ≤4ρ2 rithms, along with several of their variants. We have analyzed their convergence rate and calculated the number of iterations that would guarantee an expected shown that by using SGD we can directly minimize the risk function. We do so by sampling a point i.i.d from D and using a subgradient of the loss of the current hypothesis w(t) at this point as an unbiased estimate of the gradient (or a subgradient) of the risk function. This implies that a bound on the number of iterations also yields a sample complexity bound. Finally, we have also shown how to apply the SGD method to the problem of regularized risk minimization."
1114,1115,In future chapters we show how this yields extremely simple solvers to some optimization problems associated with regularized risk minimization.
1115,1116,"Bibliographic Remarks in the context of stochastic optimization. See, for example, (Nemirovski & Yudin"
1116,1117,"The bound we have derived for strongly convex function is due to Hazan, among all vectors that satisfy the preceding requirement. Let R = maxi ∥xi∥."
1117,1118,"• Show how to calculate a subgradient of f. pare the algorithm and the analysis to the Batch Perceptron algorithm variable step size, ηt ="
1118,1119,Support Vector Machines
1119,1120,In this chapter and the next we discuss a very useful machine learning tool: the support vector machine paradigm (SVM) for learning linear predictors in high dimensional feature spaces. The high dimensionality of the feature space raises both sample complexity and computational complexity challenges.
1120,1121,"The SVM algorithmic paradigm tackles the sample complexity challenge by searching for “large margin” separators. Roughly speaking, a halfspace separates a training set with a large margin if all the examples are not only on the correct side of the separating hyperplane but also far away from it. Restricting the algorithm to output a large margin separator can yield a small sample complexity even if the dimensionality of the feature space is high (and even inﬁnite). We introduce the concept of margin and relate it to the regularized loss minimization paradigm as well as to the convergence rate of the Perceptron algorithm."
1121,1122,"In the next chapter we will tackle the computational complexity challenge using the idea of kernels. a halfspace, (w, b), such that yi = sign(⟨w, xi⟩+ b) for all i. Alternatively, this condition can be rewritten as error is zero, which is the minimum possible error). For any separable training sample, there are many ERM halfspaces. Which one of them should the learner"
1122,1123,"Consider, for example, the training set described in the picture that follows."
1123,1124,"Personal use only. Not for distribution. Do not post. amples, our intuition would probably lead us to prefer the black hyperplane over the green one. One way to formalize this intuition is using the concept of margin."
1124,1125,"The margin of a hyperplane with respect to a training set is deﬁned to be the minimal distance between a point in the training set and the hyperplane. If a hyperplane has a large margin, then it will still separate the training set even if we slightly perturb each instance."
1125,1126,"We will see later on that the true error of a halfspace can be bounded in terms of the margin it has over the training sample (the larger the margin, the smaller the error), regardless of the Euclidean dimension in which this halfspace resides. formally, we ﬁrst express the distance between a point x to a hyperplane using the parameters deﬁning the halfspace."
1126,1127,The distance between a point x and the hyperplane deﬁned by
1127,1128,The distance between a point x and the hyperplane is deﬁned as
1128,1129,"Taking v = x −(⟨w, x⟩+ b)w we have that ∥x −v∥= |⟨w, x⟩+ b| ∥w∥= |⟨w, x⟩+ b|."
1129,1130,"Hence, the distance is at most |⟨w, x⟩+ b|. Next, take any other point u on the where the last equality is because ⟨w, v⟩= ⟨w, u⟩= −b. Hence, the distance"
1130,1131,"Support Vector Machines between x and u is at least the distance between x and v, which concludes our"
1131,1132,"On the basis of the preceding claim, the closest point in the training set to the input: (x1, y1), . . . , (xm, ym) for w of minimal norm among all the vectors that separate the data and for but now the units in which we measure the margin scale with the norm of w."
1132,1133,"Therefore, ﬁnding the largest margin halfspace boils down to ﬁnding w whose norm is minimal. Formally: yi(⟨w⋆, xi⟩+ b⋆) ≥γ⋆"
1133,1134,"Hence, the pair ( w⋆ γ⋆) satisﬁes the conditions of the quadratic optimization convex quadratic function and the constraints are linear inequalities. ∥w0∥yi(⟨w0, xi⟩+ b0) ≥"
1134,1135,"It is often more convenient to consider homogenous halfspaces, namely, halfspaces that pass through the origin and are thus deﬁned by sign(⟨w, x⟩), where the bias halfspaces to the problem of learning homogenous halfspaces by adding one more of the weight vector) as well. However, regularizing b usually does not make a signiﬁcant diﬀerence to the sample complexity. sample complexity of learning halfspaces grows with the dimensionality of the problem. Furthermore, the fundamental theorem of learning tells us that if the"
1135,1136,"To overcome this problem, we will make an additional assumption on the underlying data distribution. In particular, we will deﬁne a “separability with margin γ” assumption and will show that if the data is separable with margin follows that even if the dimensionality is very large (or even inﬁnite), as long as the data adheres to the separability with margin assumption we can still have a small sample complexity. There is no contradiction to the lower bound given in the fundamental theorem of learning because we are now making an additional assumption on the underlying data distribution."
1136,1137,"Before we formally deﬁne the separability with margin assumption, there is a scaling issue we need to resolve. Suppose that a training set S = (x1, y1), . . . , (xm, ym)"
1137,1138,"Support Vector Machines ple scaling of the data can make it separable with an arbitrarily large margin. It follows that in order to give a meaningful deﬁnition of margin we must take into account the scale of the examples as well. One way to formalize this is using the deﬁnition that follows. b⋆) ≥γ and ∥x∥≤ρ. Similarly, we say that D is separable with a (γ, ρ)-margin using a homogenous halfspace if the preceding holds with a halfspace of the form separability with margin assumption using a homogenous halfspace. Then, with and analyzed the Perceptron algorithm for ﬁnding an ERM hypothesis with the number of updates the Perceptron might make on a given training set. It is the radius of examples and γ is the margin. violated for some of the examples in the training set. This can be modeled by introducing nonnegative slack variables, ξ1, . . . , ξm, and replacing each constraint minimizes the norm of w (corresponding to the margin) and the average of ξi (corresponding to the violations of the constraints). The tradeoﬀbetween the two input: (x1, y1), . . . , (xm, ym)"
1138,1139,Recall the deﬁnition of the hinge loss:
1139,1140,"Given (w, b) and a training set S, the averaged hinge loss on S is denoted by ((w, b)). Now, consider the regularized loss minimization problem: ξi = ℓhinge((w, b), (xi, yi)) for all i, and the claim follows. only for training errors but also for large norm. halfspace, where the bias term b is set to be zero, which yields the following optimization problem:"
1140,1141,Support Vector Machines a generalization bound for the regularized loss minimization framework assuming that the loss function is convex and Lipschitz. We have already shown that the hinge loss is convex so it is only left to analyze the Lipschitzness of the hinge
1141,1142,"It is easy to verify that any subgradient of f at w is of the form αx where space as a function of the norm of that halfspace, independently of the Euclidean dimension of the space over which the halfspace is deﬁned. This becomes highly signiﬁcant when we learn via embeddings into high dimensional feature spaces, as we will consider in the next chapter."
1142,1143,"The condition that X will contain vectors with a bounded norm follows from the requirement that the loss function will be Lipschitz. This is not just a technicality. As we discussed before, separation with large margin deed, without a constraint on the scale, we can always enlarge the margin by multiplying all instances by a large scalar. dimension of the instance space. Instead, the bounds depend on the norm of the examples, ρ, the norm of the halfspace B (or equivalently the margin parameter γ) and, in the nonseparable case, the bounds also depend on the minimum hinge homogenous halfspaces is d, which implies that the error of an ERM hypothesis"
1143,1144,"Consider the problem of learning to classify a short text document according to its topic, say, whether the document is about sports or not. We ﬁrst need to dimension d to be the number of words in the dictionary. Given a document, problem, the value of ρ2 will be the maximal number of distinct words in a given"
1144,1145,"A halfspace for this problem assigns weights to words. It is natural to assume that by assigning positive and negative weights to a few dozen words we will be able to determine whether a given document is about sports or not with reasonable accuracy. Therefore, for this problem, the value of B2 can be set to therefore shown a problem in which there can be an order of magnitude diﬀerence between learning a halfspace with the SVM rule and learning a halfspace using the vanilla ERM rule."
1145,1146,"Of course, it is possible to construct problems in which the SVM bound will be worse than the VC bound. When we use SVM, we in fact introduce another tive bias can signiﬁcantly decrease our estimation error, it can also enlarge the approximation error. we minimize the hinge loss. As we have shown in the previous subsection, the with respect to the hinge loss while the approximation error in VC bounds is that of the hinge loss."
1146,1147,It is not possible to derive bounds that involve the estimation error term
1147,1148,"Support Vector Machines insensitive, and therefore there is no meaning to the norm of w or its margin function that on one hand it is scale sensitive and thus enjoys the estimation option is the ramp loss, deﬁned as penalize examples that are separated with margin. The diﬀerence between the classiﬁed but not with a signiﬁcant margin. Generalization bounds for the ramp"
1148,1149,"The reason SVM relies on the hinge loss and not on the ramp loss is that the hinge loss is convex and, therefore, from the computational point of view, minimizing the hinge loss can be performed eﬃciently. In contrast, the problem of minimizing the ramp loss is computationally intractable."
1149,1150,Optimality Conditions and “Support Vectors”*
1150,1151,"The name “Support Vector Machine” stems from the fact that the solution of therefore called support vectors. To see this, we rely on Fritz John optimality where f, g1, . . . , gm are diﬀerentiable. Then, there exists α ∈Rm such that"
1151,1152,"Historically, many of the properties of SVM have been obtained by considering"
1152,1153,We start by rewriting the problem in an equivalent form as follows. Consider
1153,1154,Now suppose that we ﬂip the order of min and max in the above equation. This
1154,1155,"The preceding inequality is called weak duality. It turns out that in our case, strong duality also holds; namely, the inequality holds with equality. Therefore,"
1155,1156,"We can simplify the dual problem by noting that once α is ﬁxed, the optimization"
1156,1157,"Support Vector Machines problem with respect to w is unconstrained and the objective is diﬀerentiable; thus, at the optimum, the gradient equals zero:"
1157,1158,"This shows us that the solution must be in the linear span of the examples, a fact we will use later to derive SVM with kernels. Plugging the preceding into"
1158,1159,Rearranging yields the dual problem
1159,1160,"Note that the dual problem only involves inner products between instances and erty is important when implementing SVM with kernels, as we will discuss in"
1160,1161,"In this section we describe a very simple algorithm for solving the optimization where vj is a subgradient of the loss function at w(j) on the random example chosen at iteration j. For the hinge loss, given an example (x, y), we can choose vj"
1161,1162,"Choose i uniformly at random from [m] not assume separability of the data and allows the constraints to be violated to some extent. The sample complexity for both types of SVM is diﬀerent from the sample complexity of straightforward halfspace learning, as it does not depend on the dimension of the domain but rather on parameters such as the maximal in the next chapter, where we will discuss the embedding of the given domain into some high dimensional feature space as means for enriching our hypothesis class. Such a procedure raises computational and sample complexity problems."
1162,1163,"The latter is solved by using SVM, whereas the former can be solved by using"
1163,1164,"SVM with kernels, as we will see in the next chapter."
1164,1165,Bibliographic Remarks
1165,1166,Support Vector Machines is equivalent to the following formulation: arable with a margin γ and such that all the instances are within a ball of radius ρ. Prove that the maximal number of updates the Batch Perceptron
1166,1167,"In the previous chapter we described the SVM paradigm for learning halfspaces in high dimensional feature spaces. This enables us to enrich the expressive power of halfspaces by ﬁrst mapping the data into a high dimensional feature space, and then learning a linear predictor in that space. This is similar to the potheses. While this approach greatly extends the expressiveness of halfspace lenges. In the previous chapter we tackled the sample complexity issue using the concept of margin. In this chapter we tackle the computational complexity challenge using the method of kernels."
1167,1168,"We start the chapter by describing the idea of embedding the data into a high dimensional feature space. We then introduce the idea of kernels. A kernel is a type of a similarity measure between instances. The special property of kernel similarities is that they can be viewed as inner products in some Hilbert space tually embedded. We introduce the “kernel trick” that enables computationally sional representation of the domain instances. Kernel based learning algorithms, tools. Their success may be attributed both to being ﬂexible for accommodating domain speciﬁc prior knowledge and to having a well developed set of eﬃcient implementation algorithms."
1168,1169,Embeddings into Feature Spaces ing training set is not separable by a halfspace.
1169,1170,"To make the class of halfspaces more expressive, we can ﬁrst map the original instance space into another space (possibly of a higher dimension) and then learn a halfspace in that space. For example, consider the example mentioned previously. Instead of learning a halfspace in the original representation let us"
1170,1171,Personal use only. Not for distribution. Do not post.
1171,1172,"We use the term feature space to denote the range of ψ. After applying ψ the data can be easily explained using the halfspace h(x) = sign(⟨w, ψ(x)⟩−b),"
1172,1173,"The basic paradigm is as follows: for some feature space F, that will usually be Rn for some n (however, the range of such a mapping can be any Hilbert space, including such spaces of inﬁnite dimension, as we will show later). image sequence ˆS = (ψ(x1), y1), . . . , (ψ(xm), ym)."
1173,1174,"Note that, for every probability distribution D over X × Y, we can readily deﬁne its image probability distribution Dψ over F × Y by setting, for every over the feature space, LDψ(h) = LD(h ◦ψ), where h ◦ψ is the composition of h"
1174,1175,"The success of this learning paradigm depends on choosing a good ψ for a given learning task: that is, a ψ that will make the image of the data distribution (close to being) linearly separable in the feature space, thus making the resulting algorithm a good learner for a given task. Picking such an embedding requires prior knowledge about that task. However, often some generic mappings that enable us to enrich the class of halfspaces and extend its expressiveness are used."
1175,1176,"One notable example is polynomial mappings, which are a generalization of the ψ we have seen in the previous example."
1176,1177,Recall that the prediction of a standard halfspace classiﬁer on an instance x
1177,1178,"In that case, p(x) = Pk of the polynomial we need to learn. We can rewrite p(x) = ⟨w, ψ(x)⟩where learning a k degree polynomial over R can be done by learning a linear mapping than halfspaces. We have seen at the beginning of this chapter an example in which the training set, in its original domain (X = R), cannot be separable"
1178,1179,"So, while the classiﬁer is always linear in the feature space, it can have highly nonlinear behavior on the original space from which instances were sampled. any ﬁnite d. But there are also inﬁnite dimensional Hilbert spaces (as we shall see later on in this chapter)."
1179,1180,"The bottom line of this discussion is that we can enrich the class of halfspaces by ﬁrst applying a nonlinear mapping, ψ, that maps the instance space into some feature space, and then learning a halfspace in that feature space. However, if large, we need many more samples in order to learn a halfspace in the range of ψ. Second, from the computational point of view, performing calculations in the high dimensional space might be too costly. In fact, even the representation of the vector w in the feature space can be unrealistic. The ﬁrst issue can be tackled using the paradigm of large margin (or low norm predictors), as we already discussed in the previous chapter in the context of the SVM algorithm."
1180,1181,In the following section we address the computational issue.
1181,1182,"We have seen that embedding the input space into some high dimensional feature space makes halfspace learning more expressive. However, the computational complexity of such learning may still pose a serious hurdle – computing linear separators over very high dimensional data may be computationally expensive."
1182,1183,"The common solution to this concern is kernel based learning. The term “kernels” is used in this context to describe inner products in the feature space. Given an embedding ψ of some domain space X into some Hilbert space, we deﬁne the kernel function K(x, x′) = ⟨ψ(x), ψ(x′)⟩. One can think of K as specifying similarity between instances and of the embedding ψ as mapping the domain set complete if all Cauchy sequences in the space converge."
1183,1184,"In our case, the norm ∥w∥is deﬁned by the inner product ⟨w, w⟩. The reason we require the range of ψ to be in a Hilbert space is that projections in a Hilbert space are well deﬁned. In particular, if M is a linear subspace of a Hilbert space, then every x in the"
1184,1185,X into a space where these similarities are realized as inner products. It turns out that many learning algorithms for halfspaces can be carried out just on the basis of the values of the kernel function over pairs of domain points. The main advantage of such algorithms is that they implement linear separators in high dimensional feature spaces without having to specify points in that space or expressing the embedding ψ explicitly. The remainder of this section is devoted to constructing such algorithms.
1185,1186,"In the previous chapter we saw that regularizing the norm of w yields a small estingly, as we show later, regularizing the norm of w is also helpful in overcoming timization problem we have derived in the previous chapter are instances of the following general problem: w (f (⟨w, ψ(x1)⟩, . . . , ⟨w, ψ(xm)⟩) + R(∥w∥)), for all i, and f(a1, . . . , am) = ∞otherwise."
1186,1187,"Assume that ψ is a mapping from X to a Hilbert space. Then, there exists a vector α ∈Rm such that w = Pm element of a Hilbert space, we can rewrite w⋆as thus ∥w∥≤∥w⋆∥. Since R is nondecreasing we obtain that R(∥w∥) ≤R(∥w⋆∥)."
1187,1188,"Additionally, for all i we have that ⟨w, ψ(xi)⟩= ⟨w⋆−u, ψ(xi)⟩= ⟨w⋆, ψ(xi)⟩, f (⟨w, ψ(x1)⟩, . . . , ⟨w, ψ(xm)⟩) = f (⟨w⋆, ψ(x1)⟩, . . . , ⟨w⋆, ψ(xm)⟩) . than the objective at w⋆and therefore w is also an optimal solution. Since respect to the coeﬃcients α instead of the coeﬃcients w as follows. Writing"
