,paragraph_number,paragraph
541,542,Minimum Description Length and Occam’s Razor
542,543,"Let H be a countable hypothesis class. Then, we can write H as a countable union of singleton classes, namely, H = S and the SRM rule becomes"
543,544,"It follows that in this case, the prior knowledge is solely determined by the weight we assign to each hypothesis. We assign higher weights to hypotheses that we believe are more likely to be the correct one, and in the learning algorithm we prefer hypotheses that have higher weights. tion over H, which is derived from the length of descriptions given to hypotheses."
544,545,"Having a hypothesis class, one can wonder about how we describe, or represent, each hypothesis in the class. We naturally ﬁx some description language. This las. In any of these languages, a description consists of ﬁnite strings of symbols (or characters) drawn from some ﬁxed alphabet. We shall now formalize these"
545,546,"Let H be the hypothesis class we wish to describe. Fix some ﬁnite set Σ of symbols (or “characters”), which we call the alphabet. For concreteness, we"
546,547,"The set of all ﬁnite length strings is denoted Σ∗. A description language for H called “the description of h,” and its length is denoted by |h|. distinct h, h′, d(h) is not a preﬁx of d(h′). That is, we do not allow that any collections of strings enjoy the following combinatorial property:"
547,548,"Nonuniform Learnability of outcomes is a member of S; at that point, stop. For each σ ∈S, let P(σ) be the probability that this process generates the string σ. Note that since S is we will stop only once the sequence of outcomes equals σ. We therefore get that, for every σ ∈S, P(σ) = esis class, H, gives rise to a weighting function w over that hypothesis class – we will simply set w(h) = free description language for H. Then, for every sample size, m, every conﬁdence where |h| is the length of d(h). . In particular, it suggests trading oﬀempirical risk for saving description length. This yields the Minimum Description Length"
548,549,Minimum Description Length (MDL)
549,550,H is a countable hypothesis class
550,551,"Let H be the class of all predictors that can be implemented using binary string obtained by running the gzip command on the program (this yields risk, the true risk of the one that has shorter description can be bounded by a lower value. Thus, this result can be viewed as conveying a philosophical message:"
551,552,"A short explanation (that is, a hypothesis that has a short length) tends to be more valid than a long explanation."
552,553,"This is a well known principle, called Occam’s razor, after William of Ockham, it explicitly. Here, we provide one possible justiﬁcation to this principle. The sense of having a longer description), the larger the sample size it has to ﬁt to guarantee that it has a small true risk, LD(h)."
553,554,"At a second glance, our Occam razor claim might seem somewhat problematic."
554,555,"In the context in which the Occam razor principle is usually invoked in science, the language according to which complexity is measured is a natural language, sume that we have two hypotheses such that |h′| is much smaller than |h|. By the preceding result, if both have the same error on a given training set, S, then the true error of h may be much higher than the true error of h′, so one should prefer h′ over h. However, we could have chosen a diﬀerent description language,"
555,556,Suddenly it looks as if one should prefer h over h′. But these are the same h and h′ for which we argued two sentences ago that h′ should be preferable. Where is
556,557,"Indeed, there is no inherent generalizability diﬀerence between hypotheses."
557,558,"The crucial aspect here is the dependency order between the initial choice of language (or, preference over hypotheses) and the training set. As we know from fore seeing the data, then we are guaranteed a rather small estimation error term . Choosing a description language (or, equivalently, some weighting of hypotheses) is a weak form of committing to a hypothesis."
558,559,"Rather than committing to a single hypothesis, we spread out our commitment eralization bound holds. Just as the choice of a single hypothesis to be evaluated by a sample can be arbitrary, so is the choice of description language."
559,560,Nonuniform Learnability
560,561,Other Notions of Learnability – Consistency
561,562,The notion of learnability can be further relaxed by allowing the needed sample probability distribution D (that is used to generate the training sample and to determine the risk). This type of performance guarantee is captured by the notion of consistency1 of a learning rule.
562,563,"Let Z be a domain set, let P be a set of ing rule A is consistent with respect to H and P if there exists a function the choice of S ∼Dm it holds that"
563,564,"The notion of consistency is, of course, a relaxation of our previous notion of nonuniform learnability. Clearly if an algorithm nonuniformly learns a class"
564,565,"H it is also universally consistent for that class. The relaxation is strict in the sense that there are consistent learning rules that are not successful nonuniform universally consistent for the class of all binary classiﬁers over N. However, as we have argued before, this class is not nonuniformly learnable."
565,566,"Consider the classiﬁcation prediction algorithm Memorize deﬁned as follows. The algorithm memorizes the training examples, and, given a test point x, it predicts the majority label among all labeled instances of x that exist in the training sample (and some ﬁxed default label if no instance of x appears algorithm is universally consistent for every countable domain X and a ﬁnite"
566,567,"Intuitively, it is not obvious that the Memorize algorithm should be viewed as a learner, since it lacks the aspect of generalization, namely, of using observed data to predict the labels of unseen examples. The fact that Memorize is a consistent algorithm for the class of all functions over any countable domain set therefore raises doubt about the usefulness of consistency guarantees. Furthermore, the probability (corresponding to weak consistency) or almost sure convergence (corresponding to strong consistency). distributions” we mean all probability distributions that have Ωcontained in their associated family of measurable subsets. which led to overﬁtting, is in fact the Memorize algorithm. In the next section we discuss the signiﬁcance of the diﬀerent notions of learnability and revisit the"
567,568,"Discussing the Diﬀerent Notions of Learnability ness. As is usually the case, the usefulness of a mathematical deﬁnition depends on what we need it for. We therefore list several possible goals that we aim to tions in light of these goals."
568,569,"What Is the Risk of the Learned Hypothesis? rithm is bounding the risk of the output predictor. Here, both PAC learning and nonuniform learning give us an upper bound on the true risk of the learned hypothesis based on its empirical risk. Consistency guarantees do not provide such a bound. However, it is always possible to estimate the risk of the output"
569,570,"How Many Examples Are Required to Be as Good as the Best Hypothesis ples we need to collect in order to learn it. Here, PAC learning gives a crisp answer. However, for both nonuniform learning and consistency, we do not know in advance how many examples are required to learn H. In nonuniform learning this number depends on the best hypothesis in H, and in consistency it also depends on the underlying distribution. In this sense, PAC learning is the only useful deﬁnition of learnability. On the ﬂip side, one should keep in mind that even if the estimation error of the predictor we learn is small, its risk may still be large if H has a large approximation error. So, for the question “How many examples are required to be as good as the Bayes optimal predictor?” even PAC guarantees do not provide us with a crisp answer. This reﬂects the fact that the usefulness of PAC learning relies on the quality of our prior knowledge."
570,571,"PAC guarantees also help us to understand what we should do next if our learning algorithm returns a hypothesis with a large risk, since we can bound the part of the error that stems from estimation error and therefore know how much of the error is attributed to approximation error. If the approximation error is large, we know that we should use a diﬀerent hypothesis class. Similarly, if a nonuniform algorithm fails, we can consider a diﬀerent weighting function over (subsets of) hypotheses. However, when a consistent algorithm fails, we have no idea whether this is because of the estimation error or the approximation error. Furthermore, even if we are sure we have a problem with the estimation"
571,572,"Nonuniform Learnability error term, we do not know how many more examples are needed to make the estimation error small."
572,573,How to Learn? How to Express Prior Knowledge?
573,574,"Maybe the most useful aspect of the theory of learning is in providing an answer to the question of “how to learn.” The deﬁnition of PAC learning yields the knowledge. It gives us a crisp way to encode prior knowledge by choosing a hypothesis class, and once this choice is made, we have a generic learning rule –"
574,575,"ERM. The deﬁnition of nonuniform learnability also yields a crisp way to encode prior knowledge by specifying weights over (subsets of) hypotheses of H. Once this choice is made, we again have a generic learning rule – SRM. The SRM rule is also advantageous in model selection tasks, where prior knowledge is partial."
575,576,"Consider the problem of ﬁtting a one dimensional polynomial to data; namely, the hypothesis class of polynomials. However, we might be uncertain regarding which degree d would give the best results for our data set: A small degree might not ﬁt the data well (i.e., it will have a large approximation error), whereas a high degree might lead to overﬁtting (i.e., it will have a large estimation error)."
576,577,"It is easy to see that the empirical risk decreases as we enlarge the degree. and would overﬁt. On the other hand, if we choose too small a hypothesis class, (i.e., a large approximation error). In contrast, we can use the SRM rule on the set of all polynomials, while ordering subsets of H according to their degree, and this will yield a 3rd degree polynomial since the combination of its empirical risk and the bound on its estimation error is the smallest. In other words, the"
577,578,"SRM rule enables us to select the right model on the basis of the data itself. The price we pay for this ﬂexibility (besides a slight increase of the estimation error relative to PAC learning w.r.t. the optimal degree) is that we do not know in advance how many examples are needed to compete with the best hypothesis in tion of consistency does not yield a natural learning paradigm or a way to encode prior knowledge. In fact, in many cases there is no need for prior knowledge at all. For example, we saw that even the Memorize algorithm, which intuitively should not be called a learning algorithm, is a consistent algorithm for any class deﬁned over a countable domain and a ﬁnite label set. This hints that consistency is a very weak requirement."
578,579,Which Learning Algorithm Should We Prefer?
579,580,"One may argue that even though consistency is a weak requirement, it is desirable that a learning algorithm will be consistent with respect to the set of all functions from X to Y, which gives us a guarantee that for enough training examples, we will always be as good as the Bayes optimal predictor. Therefore, if we have two algorithms, where one is consistent and the other one is not consistent, we should prefer the consistent algorithm. However, this argument is problematic for two reasons. First, maybe it is the case that for most “natural” distributions we will observe in practice that the sample complexity of the consistent algorithm will be so large so that in every practical situation we will not obtain enough examples to enjoy this guarantee. Second, it is not very hard to make any PAC or nonuniform learner consistent with respect to the class of all functions from"
580,581,"X to Y. Concretely, consider a countable domain, X, a ﬁnite label set Y, and a hypothesis class, H, of functions from X to Y. We can make any nonuniform learner for H be consistent with respect to the class of all classiﬁers from X to Y using the following simple trick: Upon receiving a training set, we will ﬁrst run the nonuniform learner over the training set, and then we will obtain a bound on the true risk of the learned predictor. If this bound is small enough we are done. Otherwise, we revert to the Memorize algorithm. This simple modiﬁcation makes the algorithm consistent with respect to all functions from X to Y. Since it is easy to make any algorithm consistent, it may not be wise to prefer one algorithm over the other just because of consistency considerations. that no algorithm can learn the class of all classiﬁers over an inﬁnite domain."
581,582,"In contrast, in this chapter we saw that the Memorize algorithm is consistent with respect to the class of all classiﬁers over a countable inﬁnite domain. To understand why these two statements do not contradict each other, let us ﬁrst theorem implies the following: For any algorithm, A, and a training set size, m,"
582,583,"Nonuniform Learnability will get a sample of m i.i.d. training examples, labeled by h⋆, then A is likely to return a classiﬁer with a larger error."
583,584,"The consistency of Memorize implies the following: For every distribution over depends on the distribution and on h⋆) such that if Memorize receives at least m examples it is likely to return a classiﬁer with a small error. and then ﬁnd a distribution and a labeling function that are bad for this training set size. In contrast, in consistency guarantees, we ﬁrst ﬁx the distribution and the labeling function, and only then do we ﬁnd a training set size that suﬃces for learning this particular distribution and labeling function."
584,585,"We introduced nonuniform learnability as a relaxation of PAC learnability and consistency as a relaxation of nonuniform learnability. This means that even ability. We discussed the usefulness of the diﬀerent deﬁnitions of learnability. tion Length scheme, where hypotheses with shorter descriptions are preferred, language), which we can learn (nonuniformly) using the MDL scheme. tice. The ability to learn this class is impressive, and, seemingly, this chapter should have been the last chapter of this book. This is not the case, because of the computational aspect of learning: that is, the runtime needed to apply the learning rule. For example, to implement the MDL paradigm with respect to grams, which will take forever. Even the implementation of the ERM paradigm number – much larger than the number of atoms in the visible universe. In the next chapter we formally deﬁne the computational complexity of learning. In the second part of this book we will study hypothesis classes for which the ERM or"
585,586,SRM schemes can be implemented eﬃciently.
586,587,Bibliographic Remarks the second part of this book. classiﬁcation. Show that it is impossible to assign weights to the hypotheses
587,588,"• H could be learnt nonuniformly using these weights. That is, the weighting"
588,589,"• The weights would be monotonically nondecreasing. That is, if i < j, then"
589,590,"• (*) Deﬁne such a function w when for all n Hn is countable (possibly length of h, according to some ﬁxed description language. Consider the MDL learning paradigm in which the algorithm returns:"
590,591,Nonuniform Learnability
591,592,Prove a bound on LD(hS)−LD(h∗
592,593,"B) in terms of B, the conﬁdence parameter"
593,594,"• Note: Such bounds are known as oracle inequalities in the literature: We wish to estimate how good we are compared to a reference classiﬁer (or ability: namely, that, over any inﬁnite domain, the class of all functions is not learnable even under the relaxed nonuniform variation of learning."
594,595,"Recall that an algorithm, A, nonuniformly learns a hypothesis class H if there exists a function mNUL"
595,596,If such an algorithm exists then we say that H is nonuniformly learnable. which VCdim(Hn) = ∞.
596,597,"Hint: Given a class H that shatters some inﬁnite set K, and a sequence of is nonuniformly learnable but not PAC learnable. is not nonuniformly learnable."
597,598,Let X be a countable domain and let D be a probability distribution over X.
598,599,S∼Dm [∃xi : (D({xi}) > η and xi /∈S)] ≤ne−ηm. valued) functions over any countable domain.
599,600,The Runtime of Learning
600,601,"So far in the book we have studied the statistical perspective of learning, namely, how many samples are needed for learning. In other words, we focused on the amount of information learning requires. However, when considering automated plexity of a task: that is, how much computation is involved in carrying out a learning task. Once a suﬃcient training sample is available to the learner, there is some computation to be done to extract a hypothesis or ﬁgure out the label of a given test instance. These computational resources are crucial in any practical application of machine learning. We refer to these two types of resources as the sample complexity and the computational complexity. In this chapter, we turn our attention to the computational complexity of learning. text of the computational complexity of general algorithmic tasks. This area has comments that follow summarize the basic ideas of that general theory that are most relevant to our discussion. chine the algorithm is being implemented on (e.g., what the clock rate of the machine’s CPU is). To avoid dependence on the speciﬁc machine, it is common to analyze the runtime of algorithms in an asymptotic sense. For example, we rithm on any machine that satisﬁes the requirements of some accepted abstract ing: there exist constants c and n0, which can depend on the actual machine, such that, for any value of n > n0, the runtime in seconds of sorting any n items will be at most c n log(n). It is common to use the term feasible or eﬃciently computable for tasks that can be performed by an algorithm whose running time is O(p(n)) for some polynomial function p. One should note that this type of analysis depends on deﬁning what is the input size n of any instance to which cussed in the common computational complexity literature, this input size is clearly deﬁned; the algorithm gets an input instance, say, a list to be sorted, or an arithmetic operation to be calculated, which has a well deﬁned size (say, the"
601,602,"Personal use only. Not for distribution. Do not post. number of bits in its representation). For machine learning tasks, the notion of an input size is not so clear. An algorithm aims to detect some pattern in a data set and can only access random samples of that data."
602,603,"We start the chapter by discussing this issue and deﬁne the computational complexity of learning. For advanced students, we also provide a detailed formal plementing the ERM rule. We ﬁrst give several examples of hypothesis classes where the ERM rule can be eﬃciently implemented, and then consider some tation is computationally hard. It follows that hardness of implementing ERM does not imply hardness of learning. Finally, we brieﬂy discuss how one can show hardness of a given learning task, namely, that no learning algorithm can solve"
603,604,"Computational Complexity of Learning pothesis class, H, a loss function, ℓ, and a training set of examples from Z that are sampled i.i.d. according to an unknown distribution D. Given parameters"
604,605,"As mentioned before, the actual runtime of an algorithm in seconds depends on the speciﬁc machine. To allow machine independent analysis, we use the standard approach in computational complexity theory. First, we rely on a notion of an abstract machine, such as a Turing machine (or a Turing machine over the reals sense, while ignoring constant factors, thus the speciﬁc machine is not important as long as it implements the abstract machine. Usually, the asymptote is with algorithm mentioned before, we analyze the runtime as a function of the number of items that need to be sorted."
605,606,"In the context of learning algorithms, there is no clear notion of “input size.”"
606,607,"One might deﬁne the input size to be the size of the training set the algorithm receives, but that would be rather pointless. If we give the algorithm a very ing problem, the algorithm can simply ignore the extra examples. Therefore, a sequently, the runtime available for a learning algorithm should not increase as we increase the size of the training set. Just the same, we can still analyze the runtime as a function of natural parameters of the problem such as the target accuracy, the conﬁdence of achieving that accuracy, the dimensionality of the"
607,608,"The Runtime of Learning domain set, or some measures of the complexity of the hypothesis class with which the algorithm’s output is compared."
608,609,"To illustrate this, consider a learning algorithm for the task of learning axis a sequence of the problems is ﬁxed, one can analyze the asymptotic runtime as a function of variables of that sequence."
609,610,"Before we introduce the formal deﬁnition, there is one more subtlety we need to tackle. On the basis of the preceding, a learning algorithm can “cheat,” by transferring the computational burden to the output hypothesis. For example, the algorithm can simply deﬁne the output hypothesis to be the function that stores the training set in its memory, and whenever it gets a test example x it calculates the ERM hypothesis on the training set and applies it on x. Note that in this case, our algorithm has a ﬁxed output (namely, the function that we have just described) and can run in constant time. However, learning is still hard – the hardness is now in implementing the output classiﬁer to obtain a label prediction. To prevent this “cheating,” we shall require that the output of a learning algorithm must be applied to predict the label of a new example in time that does not exceed the runtime of training (that is, computing the output classiﬁer from the input training sample). In the next subsection the advanced reader may ﬁnd a formal deﬁnition of the computational complexity of learning."
610,611,"The deﬁnition that follows relies on a notion of an underlying abstract machine, which is usually either a Turing machine or a Turing machine over the reals. We will measure the computational complexity of an algorithm using the number of “operations” it needs to perform, where we assume that for any machine that implements the underlying abstract machine there exists a constant c such that any such “operation” can be performed on the machine using c seconds. tational complexity of a ﬁxed learning problem (determined by a triplet (Z, H, ℓ) – a domain set, a benchmark hypothesis class, and a loss function). Then, in the second step we consider the rate of change of that complexity along a sequence algorithm, A, we say that A solves the learning task in time O(f) if there exists some constant number c, such that for every probability distribution D"
611,612,"• The output of A, denoted hA, can be applied to predict the label of a new is deﬁned by a domain Zn, a hypothesis class Hn, and a loss function ℓn."
612,613,Let A be a learning algorithm designed for solving learning problems of
613,614,"A with respect to the preceding sequence is O(g), if for all n, A solves the"
614,615,"We say that A is an eﬃcient algorithm with respect to a sequence (Zn, Hn, ℓn) lem can be solved eﬃciently depends on how it can be broken into a sequence of speciﬁc learning problems. For example, consider the problem of learning a ﬁnite hypothesis class. As we showed in previous chapters, the ERM rule over example takes a constant time, it is possible to implement the ERM rule in time in polynomial time. Furthermore, if we deﬁne a sequence of problems in which |Hn| = n, then the exhaustive search is still considered to be eﬃcient. However, if ity is still polynomial in n but the computational complexity of the exhaustive search algorithm grows exponentially with n (thus, rendered ineﬃcient)."
615,616,Implementing the ERM Rule
616,617,"Given a hypothesis class H, the ERMH rule is maybe the most natural learning paradigm. Furthermore, for binary classiﬁcation problems we saw that if learning is at all possible, it is possible with the ERM rule. In this section we discuss the computational complexity of implementing the ERM rule for several hypothesis sponding ERMH rule can be deﬁned as follows:"
617,618,The Runtime of Learning
618,619,"This section studies the runtime of implementing the ERM rule for several examples of learning tasks. ably mild restriction. For example, H can be the set of all predictors that can be amples of useful ﬁnite classes are any hypothesis class that can be parameterized by a ﬁnite number of parameters, where we are satisﬁed with a representation of each of the parameters using a ﬁnite number of bits, for example, the class of axis aligned rectangles in the Euclidean space, Rd, when the parameters deﬁning any given rectangle are speciﬁed up to some limited precision."
