,paragraph_number,paragraph
1605,1606,"In the following we survey some of the most popular clustering methods. In the last section of this chapter we return to the high level discussion of what is of clustering. These algorithms proceed in a sequence of rounds. They start from ing. Consequently, the number of clusters decreases with each such round. If kept going, such algorithms would eventually result in the trivial clustering in which all of the domain points share one large cluster. Two parameters, then, need to be determined to deﬁne such an algorithm clearly. First, we have to decide how to measure (or deﬁne) the distance between clusters, and, second, we have to determine when to stop merging. Recall that the input to a clustering algorithm a measure of distance between domain subsets (or clusters). The most common by the minimum distance between members of the two clusters, namely, deﬁned to be the average distance between a point in one of the clusters and a point in the other, namely, as the maximum distance between their elements, namely, start from data that is completely fragmented and keep building larger and larger clusters as they proceed. Without employing a stopping rule, the outcome of such an algorithm can be described by a clustering dendrogram: that is, a tree of domain subsets, having the singleton sets in its leaves, and the full domain as its root. For example, if the input is the elements X = {a, b, c, d, e} ⊂R2 with the Euclidean distance as depicted on the left, then the resulting dendrogram is the one depicted on the right:"
1606,1607,"The single linkage algorithm is closely related to Kruskal’s algorithm for ﬁnding a minimal spanning tree on a weighted graph. Indeed, consider the full graph whose vertices are elements of X and the weight of an edge (x, y) is the distance d(x, y). Each merge of two clusters performed by the single linkage algorithm corresponds to a choice of an edge in the aforementioned graph. It is also possible to show that the set of edges the single linkage algorithm chooses along its run forms a minimal spanning tree."
1607,1608,"If one wishes to turn a dendrogram into a partition of the space (a clustering), one needs to employ a stopping criterion. Common stopping criteria include"
1608,1609,"• Fixed number of clusters – ﬁx some parameter, k, and stop merging clusters as soon as the number of clusters is k. criterion is called “scaled distance upper bound.”"
1609,1610,"Another popular approach to clustering starts by deﬁning a cost function over a parameterized set of possible clusterings and the goal of the clustering algorithm is to ﬁnd a partitioning (clustering) of minimal cost. Under this paradigm, the clustering task is turned into an optimization problem. The objective function is a function from pairs of an input, (X, d), and a proposed clustering solution"
1610,1611,"C = (C1, . . . , Ck), to positive real numbers. Given such an objective function, which we denote by G, the goal of a clustering algorithm is deﬁned as ﬁnding, for a given input (X, d), a clustering C so that G((X, d), C) is minimized. In order to reach that goal, one has to apply some appropriate search algorithm. tion algorithm rather than the cost function or the corresponding exact solution of the minimization problem."
1611,1612,"Many common objective functions require the number of clusters, k, as a parameter. In practice, it is often up to the user of the clustering algorithm to choose the parameter k that is most suitable for the given clustering problem."
1612,1613,In the following we describe some of the most common objective functions. where each Ci is represented by a centroid µi. It is assumed that the input the squared distance between each point in X to the centroid of its cluster.
1613,1614,The centroid of Ci is deﬁned to be
1614,1615,"Gk−means((X, d), (C1, . . . , Ck)) ="
1615,1616,This can also be rewritten as
1616,1617,"Gk−means((X, d), (C1, . . . , Ck)) = munication tasks, where the members of X may be viewed as a collection of signals that have to be transmitted. While X may be a very large set of real valued vectors, digital transmission allows transmitting of only a sion under such constraints is to represent each member of X by a “close” member of some ﬁnite set µ1, . . . µk, and replace the transmission of any can be viewed as a measure of the distortion created by such a transmission representation scheme. except that it requires the cluster centroids to be members of the input set. The objective function is deﬁned by"
1617,1618,"GK−medoid((X, d), (C1, . . . , Ck)) = tive, except that the “distortion” between a data point and the centroid of its cluster is measured by distance, rather than by the square of the"
1618,1619,"GK−median((X, d), (C1, . . . , Ck)) ="
1619,1620,"An example where such an objective makes sense is the facility location problem. Consider the task of locating k ﬁre stations in a city. One can model houses as data points and aim to place the stations so as to minimize the average distance between a house and its closest ﬁre station. lution to such a clustering problem is determined by a set of cluster centers,"
1620,1621,"Gf((X, d), (C1, . . . Ck)) = where X ′ is either X or some superset of X. cluster distances (SOD)"
1621,1622,"GSOD((X, d), (C1, . . . Ck)) = approximate to within some constant). As an alternative, the following simple respect to the Euclidean distance function d(x, y) = ∥x −y∥. input: X ⊂Rn ; Number of clusters k initialize: Randomly choose initial centroids µ1, . . . , µk repeat until convergence (break ties in some arbitrary manner)"
1622,1623,"To simplify the notation, let us use the shorthand G(C1, . . . , Ck) for the"
1623,1624,It is convenient to deﬁne µ(Ci) = new partition assigned at iteration t. Using the deﬁnition of the objective as
1624,1625,"In addition, the deﬁnition of the new partition (C(t) minimizes the expression Pk (C1, . . . , Ck). Hence, we obtain that G(C(t) ), which concludes our gorithm needs in order to reach convergence. Furthermore, there is no nontrivial gorithm’s output and the minimum possible value of that objective function. In the procedure several times with diﬀerent randomly chosen initial centroids (e.g., we can choose the initial centroids to be random points from the data)."
1625,1626,"Often, a convenient way to represent the relationships between points in a data set X = {x1, . . . , xm} is by a similarity graph; each vertex represents a data point xi, and every two vertices are connected by an edge whose weight is their"
1626,1627,The clustering problem can now be formulated as follows: We want to ﬁnd a partition of the graph such that the edges between diﬀerent groups have low weights and the edges within a group have high weights.
1627,1628,"In the clustering objectives described previously, the focus was on one side of our intuitive deﬁnition of clustering – making sure that points in the same cluster are similar. We now present objectives that focus on the other requirement – points separated into diﬀerent clusters should be nonsimilar."
1628,1629,"Given a graph represented by a similarity matrix W, the simplest and most direct way to construct a partition of the graph is to solve the mincut problem, which chooses a partition C1, . . . , Ck that minimizes the objective cut(C1, . . . , Ck) = often does not lead to satisfactory partitions. The problem is that in many cases, the solution of mincut simply separates one individual vertex from the rest of the graph. Of course, this is not what we want to achieve in clustering, as clusters should be reasonably large groups of points."
1629,1630,Several solutions to this problem have been suggested. The simplest solution is to normalize the cut and deﬁne the normalized mincut objective as follows:
1630,1631,"RatioCut(C1, . . . , Ck) ="
1631,1632,The preceding objective assumes smaller values if the clusters are not too small.
1632,1633,"Unfortunately, introducing this balancing makes the problem computationally hard to solve. Spectral clustering is a way to relax the problem of minimizing"
1633,1634,Graph Laplacian and Relaxed Graph Cuts
1634,1635,"The main mathematical object for spectral clustering is the graph Laplacian matrix. There are several diﬀerent deﬁnitions of graph Laplacian in the literature, and in the following we describe one particular deﬁnition."
1635,1636,The unnormalized graph
1636,1637,Laplacian is the m × m matrix L = D −W where D is a diagonal matrix with
1637,1638,"Then, the columns of H are orthonormal to each other and"
1638,1639,"RatioCut(C1, . . . , Ck) = trace(H⊤L H)."
1639,1640,"Let h1, . . . , hk be the columns of H. The fact that these vectors are nipulations, it can be shown that trace(H⊤L H) = Pk any vector v we have"
1640,1641,"Therefore, to minimize RatioCut we can search for a matrix H whose columns |Cj|. Unfortunately, this is an integer programming problem which we cannot solve eﬃciently. Instead,"
1641,1642,"Rm,k that minimizes trace(H⊤L H). As we will see in the next chapter about to set U to be the matrix whose columns are the eigenvectors corresponding to the k minimal eigenvalues of L. The resulting algorithm is called Unnormalized"
1642,1643,Spectral Clustering.
1643,1644,Unnormalized Spectral Clustering
1644,1645,Unnormalized Spectral Clustering
1645,1646,Initialize: Compute the unnormalized graph Laplacian L corresponding to the k smallest eigenvalues
1646,1647,"Let v1, . . . , vm be the rows of U"
1647,1648,"The spectral clustering algorithm starts with ﬁnding the matrix H of the k eigenvectors corresponding to the smallest eigenvalues of the graph Laplacian matrix. It then represents points according to the rows of H. It is due to the properties of the graph Laplacians that this change of representation is useful. algorithm to detect the clusters seamlessly. Intuitively, if H is as deﬁned in whose value is nonzero only on the element corresponding to the cluster it belongs"
1648,1649,The information bottleneck method is a clustering technique introduced by
1649,1650,"Tishby, Pereira, and Bialek. It relies on notions from information theory. To illustrate the method, consider the problem of clustering text documents where corresponding to index i appears in the document. Given a set of m documents, probability over a random variable x, indicating the identity of a document (thus taking values in [m]), and a random variable y, indicating the identity of a word in the dictionary (thus taking values in [n])."
1650,1651,"With this interpretation, the information bottleneck refers to the identity of a clustering as another random variable, denoted C, that takes values in [k] (where k will be set by the method as well). Once we have formulated x, y, C as random variables, we can use tools from information theory to express a clustering objective. In particular, the information bottleneck objective is p(C|x) I(x; C) −βI(C; y) , parameter, and the minimization is over all possible probabilistic assignments of points to clusters. Intuitively, we would like to achieve two contradictory goals."
1651,1652,"On one hand, we would like the mutual information between the identity of the document and the identity of the cluster to be as small as possible. This reﬂects the fact that we would like a strong compression of the original data. On the other hand, we would like high mutual information between the clustering variable and the identity of the words, which reﬂects the goal that the “relevant” information about the document (as reﬂected by the words that appear in the document) is retained. This generalizes the classical notion of minimal suﬃcient statistics2 used in parametric statistics to arbitrary distributions."
1652,1653,Solving the optimization problem associated with the information bottleneck principle is hard in the general case. Some of the proposed methods are similar
1653,1654,"A High Level View of Clustering damental questions remain unaddressed. First and foremost, what is clustering?"
1654,1655,What is it that distinguishes a clustering algorithm from any arbitrary function that takes an input space and outputs a partition of that space? Are there any basic properties of clustering that are independent of any speciﬁc algorithm or
1655,1656,One method for addressing such questions is via an axiomatic approach. There have been several attempts to provide an axiomatic deﬁnition of clustering. Let us demonstrate this approach by presenting the attempt made by Kleinberg
1656,1657,"Consider a clustering function, F, that takes as input any ﬁnite domain X with a dissimilarity function d over its pairs and returns a partition of X."
1657,1658,Consider the following three properties of such a function:
1658,1659,"Scale Invariance (SI) For any domain set X, dissimilarity function d, and"
1659,1660,"Richness (Ri) For any ﬁnite X and every partition C = (C1, . . . Ck) of X (into nonempty subsets) there exists some dissimilarity function d over X such , where the sum is over all values x can take and all respect to a statistical model and its associated unknown parameter, meaning that “no other statistic which can be calculated from the same sample provides any additional information as to the value of the parameter.” For example, if we assume that a variable is distributed normally with a unit variance and an unknown expectation, then the average function is a suﬃcient statistic."
1660,1661,"Consistency (Co) If d and d′ are dissimilarity functions over X, such that d′(x, y) ≤d(x, y) and if x, y belong to diﬀerent clusters in F(X, d) then d′(x, y) ≥d(x, y), then F(X, d) = F(X, d′)."
1661,1662,"A moment of reﬂection reveals that the Scale Invariance is a very natural requirement – it would be odd to have the result of a clustering function depend basically states that the outcome of the clustering function is fully controlled by the function d, which is also a very intuitive feature. The third requirement,"
1662,1663,"Consistency, is the only requirement that refers to the basic (informal) deﬁnition of clustering – we wish that similar points will be clustered together and that dissimilar points will be separated to diﬀerent clusters, and therefore, if points that already share a cluster become more similar, and points that are already separated become even less similar to each other, the clustering function should have even stronger “support” of its previous clustering decisions. ties: Scale Invariance, Richness, and Consistency."
1663,1664,"Assume, by way of contradiction, that some F does satisfy all three properties. Pick some domain set X with at least three points. By Richness, some d2 such that F(X, d2) ̸= F(X, d1). αd2. Consider F(X, d3). By the Scale Invariance property of F, we should have diﬀerent clusters w.r.t. F(X, d1), and d3(x, y) ≥d1(x, y), the Consistency of F implies that F(X, d3) = F(X, d1). This is a contradiction, since we chose d1, d2 so that F(X, d2) ̸= F(X, d1)."
1664,1665,"It is important to note that there is no single “bad property” among the three properties. For every pair of the the three axioms, there exist natural clustering functions that satisfy the two properties in that pair (one can even construct such examples just by varying the stopping criteria for the Single Linkage clustering function). On the other hand, Kleinberg shows that any clustering algorithm does satisfy Consistency)."
1665,1666,"The Kleinberg impossibility result can be easily circumvented by varying the properties. For example, if one wishes to discuss clustering functions that have"
1666,1667,"Alternatively, one can relax the Consistency property. For example, say that two clusterings C = (C1, . . . Ck) and C′ = (C′ l) are compatible if for every tained by trimming that dendrogram are compatible). “Reﬁnement Consistency” is the requirement that, under the assumptions of the Consistency property, the new clustering F(X, d′) is compatible with the old clustering F(X, d). Many common clustering functions satisfy this requirement as well as Scale Invariance erties of clustering functions that sound intuitive and desirable and are satisﬁed by some common clustering functions. cating that there is no “ideal” clustering function. Every clustering function will tion for any given task must therefore take into account the speciﬁc properties theorem shows). Clustering, just like classiﬁcation prediction, must take into account some prior knowledge about the speciﬁc task at hand."
1667,1668,"Clustering is an unsupervised learning problem, in which we wish to partition tering, and the information bottleneck. We discussed the diﬃculty of formalizing the intuitive meaning of clustering."
1668,1669,"Bibliographic Remarks spectral clustering we refer the reader to the excellent tutorial by Von Luxburg and suppose we break ties in the deﬁnition of Ci by assigning i to be the smallest value in argminj ∥x −µj∥. a partition of X into C1, . . . , Ck which minimizes the expression"
1669,1670,"Gk−diam((X, d), (C1, . . . , Ck)) = max diam objective. Fortunately, we have a very simple approximation algorithm: is, if we denote its output by ˆC1, . . . , ˆCk, and denote the optimal solution by following inequalities"
1670,1671,"Gk−diam((X, d), ( ˆC1, . . . , ˆCk)) ≤2r is a clustering that minimizes the objective"
1671,1672,"Gf((X, d), (C1, . . . Ck)) = where X ′ is either X or some superset of X. ness, and Consistency. Consider the Single Linkage clustering algorithm."
1672,1673,Fixed Number of Clusters (any ﬁxed nonzero number) stopping rule.
1673,1674,"Distance Upper Bound (any ﬁxed nonzero upper bound) stopping rule. for Single Linkage clustering, under which these two axioms are satisﬁed."
1674,1675,"For any ﬁnite X and every partition C = (C1, . . . Ck) of X (into nonempty subsets) there exists some dissimilarity function d over X such that F(X, d) = C."
1675,1676,"Prove that, for every number k, there exists a clustering function that"
1676,1677,Dimensionality Reduction
1677,1678,"Dimensionality reduction is the process of taking data in a high dimensional space and mapping it into a new space whose dimensionality is much smaller. mation theory. There are several reasons to reduce the dimensionality of the data. First, high dimensional data impose computational challenges. Moreover, ties of the learning algorithm (for example, in Nearest Neighbor classiﬁers the"
1678,1679,"Finally, dimensionality reduction can be used for interpretability of the data, for ﬁnding meaningful structure of the data, and for illustration purposes."
1679,1680,"In this chapter we describe popular methods for dimensionality reduction. In those methods, the reduction is performed by applying a linear transformation to the original data. That is, if the original data is in Rd and we want to embed enable a reasonable recovery of the original x. It is not hard to show that in"
1680,1681,The ﬁrst method we describe is called Principal Component Analysis (PCA). mations and the method ﬁnds the linear transformations for which the diﬀerences between the recovered vectors and the original vectors are minimal in the least
1681,1682,"Next, we describe dimensionality reduction using random matrices W. We which analyzes the distortion caused by such a random dimensionality reduction"
1682,1683,"Last, we show how one can reduce the dimension of all sparse vectors using again a random matrix. This process is known as Compressed Sensing. In this case, the recovery process is nonlinear but can still be implemented eﬃciently using linear programming."
1683,1684,"We conclude by underscoring the underlying “prior assumptions” behind PCA and compressed sensing, which can help us understand the merits and pitfalls of"
1684,1685,Personal use only. Not for distribution. Do not post.
1685,1686,Dimensionality Reduction
1686,1687,"Principal Component Analysis (PCA) mately) recover each original vector x from its compressed version. That is, for a compressed vector y = Wx, where y is in the low dimensional space Rn, we can construct ˜x = Uy, so that ˜x is the recovered version of x and resides in the original high dimensional space Rd."
1687,1688,"In PCA, we ﬁnd the compression matrix W and the recovering matrix U so that the total squared distance between the original and recovered vectors is minimal; namely, we aim at solving the problem"
1688,1689,To solve this problem we ﬁrst show that the optimal solution takes a speciﬁc
1689,1690,"U are orthonormal (namely, U ⊤U is the identity matrix of Rn) and W = U ⊤. namely, the range of V is R and V ⊤V = I. Therefore, each vector in R can be where we used the fact that V ⊤V is the identity matrix of Rn. Minimizing the preceding expression with respect to y by comparing the gradient with respect to y to zero gives that y = V ⊤x. Therefore, for each x we have that"
1690,1691,"In particular this holds for x1, . . . , xm and therefore we can replace U, W by"
1691,1692,"V, V ⊤and by that do not increase the objective"
1692,1693,"Since this holds for every U, W the proof of the lemma follows."
1693,1694,"On the basis of the preceding lemma, we can rewrite the optimization problem"
1694,1695,"We further simplify the optimization problem by using the following elementary where the trace of a matrix is the sum of its diagonal entries. Since the trace is i . The matrix A is symmetric and therefore it can be written using its spectral decomposition as A = VDV ⊤, where D is diagonal and"
1695,1696,"V ⊤V = VV ⊤= I. Here, the elements on the diagonal of D are the eigenvalues of"
1696,1697,A and the columns of V are the corresponding eigenvectors. We assume without the matrix U whose columns are the n eigenvectors of A corresponding to the largest n eigenvalues.
1697,1698,"Let x1, . . . , xm be arbitrary vectors in Rd, let A = Pm and let u1, . . . , un be n eigenvectors of the matrix A corresponding to the largest n eigenvalues of A. Then, the solution to the PCA optimization problem given with orthonormal columns and let B = V ⊤U. Then, VB = VV ⊤U = U. It"
1698,1699,"U ⊤AU = B⊤V ⊤VDV ⊤VB = B⊤DB,"
1699,1700,"Note that B⊤B = U ⊤VV ⊤U = U ⊤U = I. Therefore, the columns of B are also orthonormal, which implies that Pd"
1700,1701,"Rd,d be a matrix such that its ﬁrst n columns are the columns of B and in addition ˜B⊤˜B = I. Then, for every j we have Pd"
1701,1702,Dimensionality Reduction thonormal columns it holds that trace(U ⊤AU) ≤Pn if we set U to be the matrix whose columns are the n leading eigenvectors of A we obtain that trace(U ⊤AU) = Pn
1702,1703,It is a common practice to “center” the examples before applying
1703,1704,"PCA. That is, we ﬁrst calculate µ = vectors (x1 −µ), . . . , (xm −µ). This is also related to the interpretation of PCA"
1704,1705,A More Eﬃcient Solution for the Case d ≫m
1705,1706,In some situations the original dimensionality of the data is much larger than the number of examples m. The computational complexity of calculating the
1706,1707,PCA solution as described previously is O(d3) (for calculating eigenvalues of A) plus O(md2) (for constructing the matrix A). We now show a simple trick that enables us to calculate the PCA solution more eﬃciently when d ≫m.
1707,1708,"Recall that the matrix A is deﬁned to be Pm i . It is convenient to rewrite ⟨xi, xj⟩. Suppose that u is an eigenvector of B: That is, Bu = λu for some λ ∈R. Multiplying the equality by X⊤and using the deﬁnition of B we obtain"
1708,1709,"X⊤XX⊤u = λX⊤u. But, using the deﬁnition of A, we get that A(X⊤u) ="
1709,1710,We can therefore calculate the PCA solution by calculating the eigenvalues of
1710,1711,B instead of A. The complexity is O(m3) (for calculating eigenvalues of B) and m2d (for constructing the matrix B).
1711,1712,The previous discussion also implies that to calculate the PCA solution we only need to know how to calculate inner products between vectors.
1712,1713,"This enables us to calculate PCA implicitly even when d is very large (or even inﬁnite) using kernels, which yields the kernel PCA algorithm."
1713,1714,Implementation and Demonstration
1714,1715,A pseudocode of PCA is given in the following. dimensionality reduction to R1 using PCA (red circles). number of components n
1715,1716,"Let u1, . . . , un be the eigenvectors of A with largest eigenvalues"
1716,1717,"Let v1, . . . , vn be the eigenvectors of B with largest eigenvalues output: u1, . . . , un"
1717,1718,"To illustrate how PCA works, let us generate vectors in R2 that approximately reside on a line, namely, on a one dimensional subspace of R2. For example, suppose that each example is of the form (x, x + y) where x is chosen uniformly eigenvector corresponding to the largest eigenvalue will be close to the vector"
1718,1719,"Next, we demonstrate the eﬀectiveness of PCA on a data set of faces. We extracted images of faces from the Yale data set (Georghiades, Belhumeur & dimensionality is very high."
1719,1720,Dimensionality Reduction reconstruction. Middle row: an enlarged version of one of the images before and after
1720,1721,PCA. Bottom: The images after dimensionality reduction to R2. The diﬀerent marks indicate diﬀerent individuals.
1721,1722,"In this section we show that reducing the dimension by using a random linear transformation leads to a simple compression scheme with a surprisingly low referred to as a random projection. In particular, we provide a variant of a famous lemma due to Johnson and Lindenstrauss, showing that random projections do not distort Euclidean distances too much."
