,paragraph_number,paragraph
0,1,Understanding Machine Learning:
1,2,From Theory to Algorithms
2,3,This copy is for personal use only. Not for distribution.
3,4,Do not post. Please link to:
4,5,"Please note: This copy is almost, but not entirely, identical to the printed version of the book. In particular, page numbers are not identical (but section numbers are the"
5,6,Understanding Machine Learning
6,7,"Machine learning is one of the fastest growing areas of computer science, pled way. The book provides an extensive theoretical account of the fundamental ideas underlying machine learning and the mathematical lowing a presentation of the basics of the ﬁeld, the book covers a wide books. These include a discussion of the computational complexity of mic paradigms including stochastic gradient descent, neural networks, and structured output learning; and emerging theoretical concepts such as an advanced undergraduate or beginning graduate course, the text makes dents and nonexpert readers in statistics, computer science, mathematics,"
7,8,"Science and Engineering at The Hebrew University, Israel."
8,9,"University of Waterloo, Canada."
9,10,"The Hebrew University, Jerusalem"
10,11,"University of Waterloo, Canada"
11,12,Cambridge University Press is part of the University of Cambridge.
12,13,"It furthers the University’s mission by disseminating knowledge in the pursuit of education, learning and research at the highest international levels of excellence."
13,14,"This publication is in copyright. Subject to statutory exception and to the provisions of relevant collective licensing agreements, no reproduction of any part may take place without the written permission of Cambridge University Press."
14,15,Printed in the United States of America
15,16,A catalog record for this publication is available from the British Library
16,17,Library of Congress Cataloging in Publication Data
17,18,"Cambridge University Press has no responsibility for the persistence or accuracy of and does not guarantee that any content on such Web sites is, or will remain, accurate or appropriate."
18,19,"The term machine learning refers to the automated detection of meaningful patterns in data. In the past couple of decades it has become a common tool in almost any task that requires information extraction from large data sets. We are surrounded by a machine learning based technology: search engines learn how learns to ﬁlter our email messages, and credit card transactions are secured by a software that learns how to detect frauds. Digital cameras learn to detect recognize voice commands. Cars are equipped with accident prevention systems that are built using machine learning algorithms. Machine learning is also widely used in scientiﬁc applications such as bioinformatics, medicine, and astronomy."
19,20,"One common feature of all of these applications is that, in contrast to more traditional uses of computers, in these cases, due to the complexity of the patterns detailed speciﬁcation of how such tasks should be executed. Taking example from intelligent beings, many of our skills are acquired or reﬁned through learning from our experience (rather than following explicit instructions given to us). Machine learning tools are concerned with endowing programs with the ability to “learn” duction to the main concepts underlying machine learning: What is learning?"
20,21,"How can a machine learn? How do we quantify the resources needed to learn a given concept? Is learning always possible? Can we know if the learning process succeeded or failed? rithms. We chose to present algorithms that on one hand are successfully used in practice and on the other hand give a wide spectrum of diﬀerent learning techniques. Additionally, we pay speciﬁc attention to algorithms appropriate for come increasingly “digitized” and the amount of data available for learning is dramatically increasing. As a result, in many applications data is plentiful and computation time is the main bottleneck. We therefore explicitly quantify both the amount of data and the amount of computation time needed to learn a given"
21,22,"The book is divided into four parts. The ﬁrst part aims at giving an initial eralization of Valiant’s Probably Approximately Correct (PAC) learning model, which is a ﬁrst solid answer to the question “what is learning?”. We describe the Empirical Risk Minimization (ERM), Structural Risk Minimization (SRM), and Minimum Description Length (MDL) learning rules, which shows “how can a machine learn”. We quantify the amount of data needed for learning using the ERM, SRM, and MDL rules and show how learning might fail by deriving quired for learning. In the second part of the book we describe various learning algorithms. For some of the algorithms, we ﬁrst present a more general learning principle, and then show how the algorithm follows the principle. While the ﬁrst two parts of the book focus on the PAC model, the third part extends the scope by presenting a wider variety of learning models. Finally, the last part of the book is devoted to advanced theory. the reader is assumed to be comfortable with basic notions of probability, linear algebra, analysis, and algorithms. The ﬁrst three parts of the book are intended for ﬁrst year graduate students in computer science, engineering, mathematics, or statistics. It can also be accessible to undergraduate students with the adequate background. The more advanced chapters can be used by researchers intending to gather a deeper theoretical understanding."
22,23,"The book is based on Introduction to Machine Learning courses taught by Shai sity of Waterloo. The ﬁrst draft of the book grew out of the lecture notes for the exercises. Alon, to whom we are indebted for his help throughout the entire making of the book, has also prepared a solution manual."
23,24,"We are deeply grateful for the most valuable work of Dana Rubinstein. Dana has scientiﬁcally proofread and edited the manuscript, transforming it from"
24,25,"Special thanks to Amit Daniely, who helped us with a careful read of the advanced part of the book and also wrote the advanced chapter on multiclass learnability. We are also grateful for the members of a book reading club in"
25,26,"Jerusalem that have carefully read and constructively criticized every line of vani, Aharon Birnbaum, Alon Cohen, Alon Gonen, Roi Livni, Ofer Meshi, Dan"
26,27,"Rosenbaum, Dana Rubinstein, Shahar Somin, Alon Vinnikov, and Yoav Wald."
27,28,"We would also like to thank Gal Elidan, Amir Globerson, Nika Haghtalab, Shie"
28,29,"Mannor, Amnon Shashua, Nati Srebro, and Ruth Urner for helpful discussions."
29,30,When Do We Need Machine Learning?
30,31,Relations to Other Fields
31,32,How to Read This Book
32,33,Possible Course Plans Based on This Book
33,34,A Formal Model – The Statistical Learning Framework
34,35,Empirical Risk Minimization
35,36,Something May Go Wrong – Overﬁtting
36,37,Empirical Risk Minimization with Inductive Bias
37,38,Finite Hypothesis Classes
38,39,A Formal Learning Model
39,40,A More General Learning Model
40,41,Releasing the Realizability Assumption – Agnostic PAC
41,42,The Scope of Learning Problems Modeled
42,43,Bibliographic Remarks
43,44,Learning via Uniform Convergence
44,45,Uniform Convergence Is Suﬃcient for Learnability
45,46,Finite Classes Are Agnostic PAC Learnable
46,47,Personal use only. Not for distribution. Do not post.
47,48,Bibliographic Remarks
48,49,Bibliographic Remarks
49,50,Axis Aligned Rectangles
50,51,The Fundamental Theorem of PAC learning
51,52,Sauer’s Lemma and the Growth Function
52,53,Uniform Convergence for Classes of Small Eﬀective Size
53,54,Bibliographic remarks
54,55,Nonuniform Learnability
55,56,Nonuniform Learnability
56,57,Characterizing Nonuniform Learnability
57,58,Structural Risk Minimization
58,59,Minimum Description Length and Occam’s Razor
59,60,Other Notions of Learnability – Consistency
60,61,Discussing the Diﬀerent Notions of Learnability
61,62,Bibliographic Remarks
62,63,The Runtime of Learning
63,64,Computational Complexity of Learning
64,65,Implementing the ERM Rule
65,66,Axis Aligned Rectangles
66,67,Boolean Conjunctions
67,68,"Eﬃciently Learnable, but Not by a Proper ERM"
68,69,Bibliographic Remarks
69,70,From Theory to Algorithms
70,71,Linear Programming for the Class of Halfspaces
71,72,Perceptron for Halfspaces
72,73,The VC Dimension of Halfspaces
73,74,Linear Regression for Polynomial Regression Tasks
74,75,Bibliographic Remarks
75,76,Eﬃcient Implementation of ERM for Decision Stumps
76,77,Linear Combinations of Base Hypotheses
77,78,AdaBoost for Face Recognition
78,79,Bibliographic Remarks
79,80,Model Selection and Validation
80,81,Model Selection Using SRM
81,82,Validation for Model Selection
82,83,What to Do If Learning Fails
83,84,Convex Learning Problems
84,85,"Convexity, Lipschitzness, and Smoothness"
85,86,Convex Learning Problems
86,87,Learnability of Convex Learning Problems
87,88,Surrogate Loss Functions
88,89,Bibliographic Remarks
89,90,Regularization and Stability
90,91,Regularized Loss Minimization
91,92,Stable Rules Do Not Overﬁt
92,93,Tikhonov Regularization as a Stabilizer
93,94,Smooth and Nonnegative Loss
94,95,Bibliographic Remarks
95,96,Stochastic Gradient Descent
96,97,Calculating Subgradients
97,98,Subgradients of Lipschitz Functions
98,99,Stochastic Gradient Descent (SGD)
99,100,Adding a Projection Step
100,101,Other Averaging Techniques
101,102,SGD for Risk Minimization
102,103,SGD for Regularized Loss Minimization
103,104,Bibliographic Remarks
104,105,Support Vector Machines
105,106,Optimality Conditions and “Support Vectors”*
106,107,Bibliographic Remarks
107,108,Embeddings into Feature Spaces
108,109,Kernels as a Way to Express Prior Knowledge
109,110,Bibliographic Remarks
110,111,"Multiclass, Ranking, and Complex Prediction Problems"
111,112,Linear Multiclass Predictors
112,113,Generalized Hinge Loss
113,114,Multiclass SVM and SGD
114,115,Structured Output Prediction
115,116,Linear Predictors for Ranking
116,117,Bipartite Ranking and Multivariate Performance Measures
117,118,Linear Predictors for Bipartite Ranking
118,119,Bibliographic Remarks
119,120,Decision Tree Algorithms
120,121,Implementations of the Gain Measure
121,122,Bibliographic Remarks
122,123,The “Curse of Dimensionality”
123,124,Bibliographic Remarks
124,125,Feedforward Neural Networks
125,126,Learning Neural Networks
126,127,The Expressive Power of Neural Networks
127,128,The Sample Complexity of Neural Networks
128,129,The Runtime of Learning Neural Networks
129,130,SGD and Backpropagation
130,131,Bibliographic Remarks
131,132,Additional Learning Models
132,133,Online Classiﬁcation in the Realizable Case
133,134,Online Classiﬁcation in the Unrealizable Case
134,135,Online Convex Optimization
135,136,The Online Perceptron Algorithm
136,137,Bibliographic Remarks
137,138,Graph Laplacian and Relaxed Graph Cuts
138,139,Unnormalized Spectral Clustering
139,140,A High Level View of Clustering
140,141,Bibliographic Remarks
141,142,Dimensionality Reduction
142,143,Principal Component Analysis (PCA)
143,144,A More Eﬃcient Solution for the Case d ≫m
144,145,Implementation and Demonstration
145,146,PCA or Compressed Sensing?
146,147,Bibliographic Remarks
147,148,Maximum Likelihood Estimator
148,149,Maximum Likelihood and Empirical Risk Minimization
149,150,Generalization Analysis
150,151,Linear Discriminant Analysis
151,152,Latent Variables and the EM Algorithm
152,153,EM as an Alternate Maximization Algorithm
153,154,Bibliographic Remarks
154,155,Feature Selection and Generation
155,156,Greedy Selection Approaches
156,157,Feature Manipulation and Normalization
157,158,Examples of Feature Transformations
158,159,Bibliographic Remarks
159,160,Rademacher Complexities
160,161,The Rademacher Complexity
161,162,Rademacher Complexity of Linear Classes
162,163,Generalization Bounds for SVM
163,164,Generalization Bounds for Predictors with Low ℓ1 Norm
164,165,Bibliographic Remarks
165,166,From Covering to Rademacher Complexity via Chaining
166,167,Bibliographic Remarks
167,168,Proof of the Fundamental Theorem of Learning Theory
168,169,The Upper Bound for the Agnostic Case
169,170,The Lower Bound for the Agnostic Case
170,171,The Upper Bound for the Realizable Case
171,172,Multiclass Learnability
172,173,The Natarajan Dimension
173,174,The Multiclass Fundamental Theorem
174,175,Calculating the Natarajan Dimension
175,176,Linear Multiclass Predictors
176,177,On Good and Bad ERMs
177,178,Bibliographic Remarks
178,179,Axis Aligned Rectangles
179,180,Separating Polynomials
180,181,Separation with Margin
181,182,Bibliographic Remarks
182,183,Bibliographic Remarks
183,184,Measure Concentration
184,185,"The subject of this book is automated learning, or, as we will more often call it, Machine Learning (ML). That is, we wish to program computers so that they can “learn” from input available to them. Roughly speaking, learning is the process of converting experience into expertise or knowledge. The input to a learning algorithm is training data, representing experience, and the output is some expertise, which usually takes the form of another computer program this concept, we’ll have to be more explicit about what we mean by each of the involved terms: What is the training data our programs will access? How can the process of learning be automated? How can we evaluate the success of such a process (namely, the quality of the output of a learning program)? mal learning. Some of the most fundamental issues in ML arise already in that context, which we are all familiar with."
185,186,"Bait Shyness – Rats Learning to Avoid Poisonous Baits: When rats encounter food items with novel look or smell, they will ﬁrst eat very small amounts, and subsequent feeding will depend on the ﬂavor of the food and its physiological eﬀect. If the food produces an ill eﬀect, the novel food will often be associated with the illness, and subsequently, the rats will not eat it. Clearly, there is a learning mechanism in play here – the animal used past experience with some food to acquire expertise in detecting the safety of this food. If past experience with the food was negatively labeled, the animal predicts that it will also have a negative eﬀect when encountered in the future."
186,187,"Inspired by the preceding example of successful learning, let us demonstrate a typical machine learning task. Suppose we would like to program a machine that to the way rats learn how to avoid poisonous baits. The machine will simply"
187,188,"Personal use only. Not for distribution. Do not post. it will be moved to the user’s inbox folder. ful, it lacks an important aspect of learning systems – the ability to label unseen examples to broader generalization. This is also referred to as inductive reasoning or inductive inference. In the bait shyness example presented previously, after the rats encounter an example of a certain type of food, they apply their attitude toward it on new, unseen examples of food of similar smell and taste. To achieve generalization in the spam ﬁltering task, the learner can scan the previously seen ingly. Such a system would potentially be able correctly to predict the label of"
188,189,"However, inductive reasoning might lead us to false conclusions. To illustrate this, let us consider again an example from animal learning."
189,190,"Pigeon Superstition: In an experiment performed by the psychologist B. F. Skinner, he placed a bunch of hungry pigeons in a cage. An automatic mechanism had been attached to the cage, delivering food to the pigeons at regular intervals with no reference whatsoever to the birds’ behavior. The hungry pigeons went around the cage, and when food was ﬁrst delivered, it found each pigeon engaged in some activity (pecking, turning the head, etc.). The arrival of food reinforced each bird’s speciﬁc action, and consequently, each bird tended to spend some more time doing that very same action. That, in turn, increased the chance that the next random food delivery would ﬁnd each bird engaged in that activity again. What results is a chain of events that reinforces the pigeons’ association ing when it was ﬁrst delivered. They subsequently continue to perform these"
190,191,What distinguishes learning mechanisms that result in superstition from useful learning? This question is crucial to the development of automated learners.
191,192,"While human learners can rely on common sense to ﬁlter out random meaningless learning conclusions, once we export the task of learning to a machine, we must provide well deﬁned crisp principles that will protect the program from reaching senseless or useless conclusions. The development of such principles is a central goal of the theory of machine learning."
192,193,"What, then, made the rats’ learning more successful than that of the pigeons?"
193,194,"As a ﬁrst step toward answering this question, let us have a closer look at the bait shyness phenomenon in rats."
194,195,"Bait Shyness revisited – rats fail to acquire conditioning between food and electric shock or between sound and nausea: The bait shyness mechanism in rats turns out to be more complex than what one may expect. In experiments unpleasant stimulus that follows food consumption is replaced by, say, electrical shock (rather than nausea), then no conditioning occurs. Even after repeated trials in which the consumption of some food is followed by the administration of unpleasant electrical shock, the rats do not tend to avoid that food. Similar failure of conditioning occurs when the characteristic of the food that implies nausea (such as taste or smell) is replaced by a vocal signal. The rats seem to have some “built in” prior knowledge telling them that, while temporal correlation between food and nausea can be causal, it is unlikely that there would be a causal relationship between food consumption and electrical shocks or between"
195,196,We conclude that one distinguishing feature between the bait shyness learning and the pigeon superstition is the incorporation of prior knowledge that biases the learning mechanism. This is also referred to as inductive bias. The pigeons in the experiment are willing to adopt any explanation for the occurrence of food.
196,197,"However, the rats “know” that food cannot cause an electric shock and that the of that food. The rats’ learning process is biased toward detecting some kind of patterns while ignoring other temporal correlations between events."
197,198,"It turns out that the incorporation of prior knowledge, biasing the learning process, is inevitable for the success of learning algorithms (this is formally stated tools for expressing domain expertise, translating it into a learning bias, and quantifying the eﬀect of such a bias on the success of learning is a central theme of the theory of machine learning. Roughly speaking, the stronger the prior knowledge (or prior assumptions) that one starts the learning process with, the easier it is to learn from further examples. However, the stronger these prior assumptions are, the less ﬂexible the learning is – it is bound, a priori, by the commitment to these assumptions. We shall discuss these issues explicitly in"
198,199,When Do We Need Machine Learning?
199,200,When do we need machine learning rather than directly program our computers to carry out the task at hand? Two aspects of a given problem may call for the use of programs that learn and improve on the basis of their “experience”: the problem’s complexity and the need for adaptivity.
200,201,"Tasks That Are Too Complex to Program. ing how we do them is not suﬃciently elaborate to extract a well deﬁned program. Examples of such tasks include driving, speech recognition, and image understanding. In all of these tasks, state of the art machine learning programs, programs that “learn from their experience,” achieve quite satisfactory results, once exposed to suﬃciently many training examples."
201,202,"• Tasks beyond Human Capabilities: Another wide family of tasks that sis of very large and complex data sets: astronomical data, turning ysis of genomic data, Web search engines, and electronic commerce."
202,203,"With more and more available digitally recorded data, it becomes obvious that there are treasures of meaningful information buried in data archives that are way too large and too complex for humans to make sense of. Learning to detect meaningful patterns in large nation of programs that learn with the almost unlimited memory capacity and ever increasing processing speed of computers opens"
203,204,"Adaptivity. One limiting feature of programmed tools is their rigidity – once the program has been written down and installed, it stays unchanged."
204,205,"However, many tasks change over time or from one user to another."
205,206,"Machine learning tools – programs whose behavior adapts to their input data – oﬀer a solution to such issues; they are, by nature, adaptive to changes in the environment they interact with. Typical successful applications of machine learning to such problems include programs that decode handwritten text, where a ﬁxed program can adapt to variations between the handwriting of diﬀerent users; spam detection programs, speech recognition programs."
206,207,"Learning is, of course, a very wide domain. Consequently, the ﬁeld of machine ing tasks. We give a rough taxonomy of learning paradigms, aiming to provide some perspective of where the content of this book sits within the wide ﬁeld of"
207,208,"We describe four parameters along which learning paradigms can be classiﬁed. tween the learner and the environment, one can divide learning tasks according to the nature of that interaction. The ﬁrst distinction to note is the diﬀerence between supervised and unsupervised learning. As an versus the task of anomaly detection. For the spam detection task, we sage. In contrast, for the task of anomaly detection, all the learner gets learner’s task is to detect “unusual” messages."
208,209,"More abstractly, viewing learning as a process of “using experience to gain expertise,” supervised learning describes a scenario in which the “experience,” a training example, contains signiﬁcant information (say, quired expertise is aimed to predict that missing information for the test data. In such cases, we can think of the environment as a teacher that “supervises” the learner by providing the extra information (labels). In unsupervised learning, however, there is no distinction between training and test data. The learner processes input data with the goal of coming up with some summary, or compressed version of that data. Clustering a data set into subsets of similar objets is a typical example of such a"
209,210,"There is also an intermediate learning setting in which, while the training examples contain more information than the test examples, the ples. For example, one may try to learn a value function that describes for ter than the Black’s. Yet, the only information available to the learner at training time is positions that occurred throughout actual chess games, labeled by who eventually won that game. Such learning frameworks are mainly investigated under the title of reinforcement learning."
210,211,"Active versus Passive Learners Learning paradigms can vary by the role played by the learner. We distinguish between “active” and “passive” learners. An active learner interacts with the environment at training time, say, by posing queries or performing experiments, while a passive learner only observes the information provided by the environment (or the teacher) without inﬂuencing or directing it. Note that the learner of a ing to them. In an active setting, one could imagine asking users to label"
211,212,"Helpfulness of the Teacher When one thinks about human learning, of a baby at home or a student at school, the process often involves a helpful ful for achieving the learning goal. In contrast, when a scientist learns about nature, the environment, playing the role of the teacher, can be best thought of as passive – apples drop, stars shine, and the rain falls narios by postulating that the training data (or the learner’s experience) is generated by some random process. This is the basic building block in the branch of “statistical learning.” Finally, learning also occurs when the learner’s input is generated by an adversarial “teacher.” This may be the case in the spam ﬁltering example (if the spammer makes an eﬀort to mislead the spam ﬁltering designer) or in learning to detect fraud. when no milder setup can be safely assumed. If you can learn against an adversarial teacher, you are guaranteed to succeed interacting any odd"
212,213,"Online versus Batch Learning Protocol The last parameter we mention is the distinction between situations in which the learner has to respond online, throughout the learning process, and settings in which the learner has to engage the acquired expertise only after having a chance to process large amounts of data. For example, a stockbroker has to make daily decisions, based on the experience collected so far. He may become an expert over time, but might have made costly mistakes in the process. In contrast, in many data mining settings, the learner – the data miner – has large amounts of training data to play with before having to output"
213,214,In this book we shall discuss only a subset of the possible learning paradigms.
